{
  "schema": "openbfme.snapshot.v1",
  "tick": 300,
  "tick_ms": 33,
  "hash": "9f2c1a4b0d3e5f6a7b8c9d0e1f2a3b4c5d6e7f8a9b0c1d2e3f4a5b6c7d8e9f00",
  "object_count": 3,
  "objects": {
    "id": [1, 2, 3],
    "template": [12, 12, 40],
    "owner": [0, 0, 1],
    "x": [1200.0, 1210.0, 1600.0],
    "y": [0.0, 0.0, 0.0],
    "z": [800.0, 800.0, 820.0],
    "yaw": [0.0, 0.0, 3.14159],
    "health": [120.0, 95.0, 2000.0],
    "max_health": [120.0, 120.0, 2000.0],
    "state": [1, 3, 0],
    "anim": [0, 2, 0],
    "anim_frame": [4.5, 11.0, 0.0],
    "flags": [1, 1, 1]
  },
  "hordes": [
    { "id": 100, "owner": 0, "template": 11, "members": [1, 2], "formation": 0 }
  ],
  "players": [
    { "index": 0, "resources": 1450, "command_points": 20, "command_points_max": 300, "power_points": 1 },
    { "index": 1, "resources": 980, "command_points": 0, "command_points_max": 300, "power_points": 1 }
  ],
  "events": [
    { "kind": "damage", "object": 2, "target": 3, "amount": 25.0 },
    { "kind": "sound", "object": 2, "name": "GondorSoldierVoiceAttack" }
  ]
}
